{"audio":{"channels":1,"duration_seconds":25.384603174603175,"frames":1119461,"sample_rate_hz":44100,"sample_width_bits":16},"completed_at":"2026-08-28T22:35:52+00:00","created_at":"2026-08-28T22:35:18+00:00","defect_reference":"C:\\Users\\ns277\\OneDrive\\Документы\\New project 2\\factory\\pilots\\celebrity-kanye-petersburg-20260828\\qc\\fish-generation-1-defect.json","defect_sha256":"3382de4cb8803361592d8f04f9a5145a7f4bb93f520870295980d13341e5c152","estimated_cost_usd":0.0,"generation_limit":2,"generation_no":2,"immutable_output_path":"C:\\Users\\ns277\\OneDrive\\Документы\\New project 2\\factory\\pilots\\celebrity-kanye-petersburg-20260828\\assets\\audio\\.fish_audio\\celebrity-kanye-petersburg-20260828\\v02-808788235752.wav","job_id":"celebrity-kanye-petersburg-20260828","model":"s2.1-pro-free","output_bytes":2238966,"output_sha256":"f9591bd89efdaca2710cee0a12e261650a9138138dac958c8a1b018a537d4980","provider":"fish_audio","reference_id":"003532fff0f4425cac625dd4fdd90c7b","render_target_sample_rate_hz":48000,"request_hash":"80878823575237c365a19b27844cd93c595d3f69302a7b22b0a5f0942d890e4b","retry_of_generation_status":"succeeded","retry_of_output_sha256":"5384bdabe015d240ad6505ad95476c2a70f059865abc0a14daf5cc126130b1fe","retry_of_request_hash":"1e4d9b754043a73ec4c6ef311a2ac74a690741d39b4f3f53fdb963c7b0c09fe8","retry_reason":"pronunciation","schema_version":"1.0.0","text_bytes":804,"text_sha256":"209df6fcda33563e1f034f5bcda28d463e847b5def6911036f81cf255ff66084","video_id":"celebrity-kanye-petersburg-20260828","voice_rights_status":"user_confirmation_required"}
