{"audio":{"channels":1,"duration_seconds":25.98950113378685,"frames":1146137,"sample_rate_hz":44100,"sample_width_bits":16},"completed_at":"2026-08-29T15:31:03+00:00","created_at":"2026-08-29T15:30:54+00:00","defect_reference":null,"defect_sha256":null,"estimated_cost_usd":0.0,"generation_limit":2,"generation_no":1,"immutable_output_path":"C:\\Users\\ns277\\OneDrive\\Документы\\New project 2\\factory\\pilots\\client-final-celeb-v2-20260829\\assets\\audio\\.fish_audio\\client-final-celeb-v2-20260829\\v01-c3ed421956e6.wav","job_id":"client-final-celeb-v2-20260829","model":"s2.1-pro-free","output_bytes":2292318,"output_sha256":"93b7d9bfbbb6279488bd94cbaf94fe7f6b240eb8ff191f2e0f3557ae84b06342","provider":"fish_audio","reference_id":"0c4c5574a38740639e4e6b5a796292bc","render_target_sample_rate_hz":48000,"request_hash":"c3ed421956e6437dc96b3d7fcd5688d0af48e25c89c7a92eb521a8617499b637","retry_of_generation_status":null,"retry_of_output_sha256":null,"retry_of_request_hash":null,"retry_reason":null,"schema_version":"1.0.0","text_bytes":853,"text_sha256":"d68ee38c1b088e5de239aae45e92e5866fa31cc332ca3e997ad2c90361f229a3","video_id":"client-final-celeb-v2-20260829","voice_rights_status":"user_confirmation_required"}
