{"audio":{"channels":1,"duration_seconds":29.57077097505669,"frames":1304071,"sample_rate_hz":44100,"sample_width_bits":16},"completed_at":"2026-08-29T11:45:30+00:00","created_at":"2026-08-29T11:45:23+00:00","defect_reference":null,"defect_sha256":null,"estimated_cost_usd":0.0,"generation_limit":2,"generation_no":1,"immutable_output_path":"C:\\Users\\ns277\\OneDrive\\Документы\\New project 2\\factory\\pilots\\chinese-medicine-cupping-20260829\\assets\\audio\\.fish_audio\\chinese-medicine-cupping-20260829\\v01-9db253ee9e8b.wav","job_id":"chinese-medicine-cupping-20260829","model":"s2.1-pro-free","output_bytes":2608186,"output_sha256":"5080f8e169d698ca42e61fc5154d57d7d656d6e93fd87649c3e64262f8f966c1","provider":"fish_audio","reference_id":"003532fff0f4425cac625dd4fdd90c7b","render_target_sample_rate_hz":48000,"request_hash":"9db253ee9e8b18491acc84b8cd6eb645df83dd0d30b4c4466574ce02b901b253","retry_of_generation_status":null,"retry_of_output_sha256":null,"retry_of_request_hash":null,"retry_reason":null,"schema_version":"1.0.0","text_bytes":872,"text_sha256":"49b9ed384bb521b9c16230e1e8dd611abaaefbf0685f8a5182d41c89d02d324b","video_id":"chinese-medicine-cupping-20260829","voice_rights_status":"user_confirmation_required"}
