{"audio":{"channels":1,"duration_seconds":28.67625850340136,"frames":1264623,"sample_rate_hz":44100,"sample_width_bits":16},"completed_at":"2026-08-29T12:26:27+00:00","created_at":"2026-08-29T12:26:17+00:00","defect_reference":"C:\\Users\\ns277\\OneDrive\\Документы\\New project 2\\factory\\pilots\\health-handwashing-temperature-20260829\\qc\\fish-generation-1-defect.json","defect_sha256":"6ed0170a4295644ccc59eccf87b34ede1e5d76925f76ed9a517504fa3d386bcb","estimated_cost_usd":0.0,"generation_limit":2,"generation_no":2,"immutable_output_path":"C:\\Users\\ns277\\OneDrive\\Документы\\New project 2\\factory\\pilots\\health-handwashing-temperature-20260829\\assets\\audio\\.fish_audio\\health-handwashing-temperature-20260829\\v02-2bdb03fcd17c.wav","job_id":"health-handwashing-temperature-20260829","model":"s2.1-pro-free","output_bytes":2529290,"output_sha256":"a422f2fd93e9b3a799e4cdb898dd612b0c1ec4e85a3b4863b386e4c2818cb949","provider":"fish_audio","reference_id":"003532fff0f4425cac625dd4fdd90c7b","render_target_sample_rate_hz":48000,"request_hash":"2bdb03fcd17c353ecd7aadf136194b5d2c92c75db36bee71a1cd25dcf48e2e96","retry_of_generation_status":"succeeded","retry_of_output_sha256":"c3e24ba97018b9c35eacaa64e93a367bebbeeab9d8b85cbc9e3023dc30456073","retry_of_request_hash":"4ef0db661e6ee6312d26011ec8028817b4b7c9f6fd2800ca7cc179e48b5aad25","retry_reason":"text_error","schema_version":"1.0.0","text_bytes":862,"text_sha256":"e7f6300a93c4f5cc19ef4a3fb6ccc057615bac711437ece38bf6b8b93e88d976","video_id":"health-handwashing-temperature-20260829","voice_rights_status":"user_confirmation_required"}
