{"audio":{"channels":1,"duration_seconds":26.551133786848073,"frames":1170905,"sample_rate_hz":44100,"sample_width_bits":16},"completed_at":"2026-08-29T11:45:30+00:00","created_at":"2026-08-29T11:45:23+00:00","defect_reference":null,"defect_sha256":null,"estimated_cost_usd":0.0,"generation_limit":2,"generation_no":1,"immutable_output_path":"C:\\Users\\ns277\\OneDrive\\Документы\\New project 2\\factory\\pilots\\health-handwashing-temperature-20260829\\assets\\audio\\.fish_audio\\health-handwashing-temperature-20260829\\v01-4ef0db661e6e.wav","job_id":"health-handwashing-temperature-20260829","model":"s2.1-pro-free","output_bytes":2341854,"output_sha256":"c3e24ba97018b9c35eacaa64e93a367bebbeeab9d8b85cbc9e3023dc30456073","provider":"fish_audio","reference_id":"003532fff0f4425cac625dd4fdd90c7b","render_target_sample_rate_hz":48000,"request_hash":"4ef0db661e6ee6312d26011ec8028817b4b7c9f6fd2800ca7cc179e48b5aad25","retry_of_generation_status":null,"retry_of_output_sha256":null,"retry_of_request_hash":null,"retry_reason":null,"schema_version":"1.0.0","text_bytes":794,"text_sha256":"abb9f7e3274c59358a1d783a4f8f7f3c7a0ccab64ec1b3c7dfdd80ac7895d850","video_id":"health-handwashing-temperature-20260829","voice_rights_status":"user_confirmation_required"}
