{"audio":{"channels":1,"duration_seconds":47.57984126984127,"frames":2098271,"sample_rate_hz":44100,"sample_width_bits":16},"completed_at":"2026-08-28T11:11:14+00:00","created_at":"2026-08-28T11:10:24+00:00","defect_reference":"C:\\Users\\ns277\\OneDrive\\Документы\\New project 2\\factory\\pilots\\celebrity-practical-magic-2\\qc\\fish-generation-1-defect.json","defect_sha256":"aee6658722a2bb5a0ffe1134ef7dcc5621d7d87e287301d44bc57a0d3850ab56","estimated_cost_usd":0.0,"generation_limit":2,"generation_no":2,"immutable_output_path":"C:\\Users\\ns277\\OneDrive\\Документы\\New project 2\\factory\\pilots\\celebrity-practical-magic-2\\assets\\audio\\fish\\.fish_audio\\celebrity-practical-magic-2\\v02-78b00f625b74.wav","job_id":"celebrity-practical-magic-2","model":"s2.1-pro-free","output_bytes":4196586,"output_sha256":"3b7000221fe2801d34ceb96ff6b5db9bda303e1569d2e5c672c9a2a7f2c0601d","provider":"fish_audio","reference_id":"003532fff0f4425cac625dd4fdd90c7b","render_target_sample_rate_hz":48000,"request_hash":"78b00f625b74ce08176cc7f3336810deba7156c9c914982c23e94ff290bf0d9a","retry_of_generation_status":"failed","retry_of_output_sha256":null,"retry_of_request_hash":"53286d9879a40d9d67e123f75c8e66fa888edba6d3ed19cb0e09e8fc0e61aaa9","retry_reason":"provider_failure","schema_version":"1.0.0","text_bytes":1403,"text_sha256":"047ef881ebd3d3274e18d001e58e806d17d080eabb8f4c4baedd940765251595","video_id":"celebrity-practical-magic-2","voice_rights_status":"user_confirmation_required"}
