{"audio":{"channels":1,"duration_seconds":34.819863945578234,"frames":1535556,"sample_rate_hz":44100,"sample_width_bits":16},"completed_at":"2026-08-29T11:45:31+00:00","created_at":"2026-08-29T11:45:23+00:00","defect_reference":null,"defect_sha256":null,"estimated_cost_usd":0.0,"generation_limit":2,"generation_no":1,"immutable_output_path":"C:\\Users\\ns277\\OneDrive\\Документы\\New project 2\\factory\\pilots\\war-midway-water-ruse-20260829\\assets\\audio\\.fish_audio\\war-midway-water-ruse-20260829\\v01-d89105e2e096.wav","job_id":"war-midway-water-ruse-20260829","model":"s2.1-pro-free","output_bytes":3071156,"output_sha256":"923070b09e7fe2f3c4aff828f9ff4ca3766da3c98ecf6b6b41ccd9903b4fe90a","provider":"fish_audio","reference_id":"003532fff0f4425cac625dd4fdd90c7b","render_target_sample_rate_hz":48000,"request_hash":"d89105e2e0967b1371dda9d54ed7fb78ace51d33fac76c63d6d9897939f600b6","retry_of_generation_status":null,"retry_of_output_sha256":null,"retry_of_request_hash":null,"retry_reason":null,"schema_version":"1.0.0","text_bytes":998,"text_sha256":"79644e5c1bbc4fdfeb6268fcc2a21f1c9d5ec9181cb103f6281abb153bc4debd","video_id":"war-midway-water-ruse-20260829","voice_rights_status":"user_confirmation_required"}
